{
  "indexFormat": "CatalogAuthoringVisualIndex",
  "indexVersion": "1.0.0",
  "editorIncrement": "05.60",
  "coreKitVersion": "1.7.2",
  "entrypoint": "START-HERE.md",
  "entries": [
    {
      "id": "interface.editor-map",
      "kind": "interface-map",
      "title": "Mapa anotado da interface",
      "intent": "Localizar as superfícies reais antes de executar um fluxo",
      "guidePath": "interface/README.md",
      "previewPath": "interface/editor-map.svg",
      "artifactPaths": ["interface/editor-reference.png"],
      "provenance": { "sourceIncrement": "05.17", "verifiedAgainstIncrement": "05.60", "viewport": "1366x768", "baseline": false },
      "featureGuideIds": ["start.page-structure", "inspect.progressive"],
      "capabilityIds": ["progressiveInspectorVocabulary", "oneClickInsertion"],
      "componentTypes": [],
      "recipeIds": []
    },
    {
      "id": "tutorial.first-page",
      "kind": "tutorial",
      "title": "De dados a uma página importável",
      "intent": "Executar o fluxo principal CatalogSource → compilador → editor → pacote/PDF",
      "guidePath": "tutorials/01-first-page/README.md",
      "previewPath": "tutorials/01-first-page/walkthrough.svg",
      "artifactPaths": ["tutorials/01-first-page/reference-canvas-05.17.png", "examples/first-page.document.json", "examples/first-page.report.json", "../examples/reference-catalog-source.json", "../examples/catalog-generation-plan.json"],
      "provenance": { "sourceIncrement": "05.17", "verifiedAgainstIncrement": "05.60", "baseline": false },
      "featureGuideIds": ["start.semantic-source", "transfer.import", "transfer.package", "transfer.pdf"],
      "capabilityIds": ["semanticCatalogSource", "generationPlanCompiler", "catalogSourceDirectImport", "projectPackageExport", "printPdf"],
      "componentTypes": ["product-card", "data-table"],
      "recipeIds": ["page-catalog-base", "section-hero-grid-strip"]
    },
    {
      "id": "tutorial.factual-assets",
      "kind": "tutorial",
      "title": "Imagem factual sem deformação",
      "intent": "Enquadrar o produto sem deformação e criar derivados factuais apenas quando necessários",
      "guidePath": "tutorials/02-factual-assets/README.md",
      "previewPath": "tutorials/02-factual-assets/walkthrough.svg",
      "artifactPaths": ["cookbook/factual-image-fit.svg", "../authoring-patterns.json"],
      "featureGuideIds": ["content.assets"],
      "capabilityIds": ["assetFormats", "packageAssetPolicy"],
      "componentTypes": ["art"],
      "recipeIds": []
    },
    {
      "id": "tutorial.product-arrangement",
      "kind": "tutorial",
      "title": "Modo editorial versus arranjo",
      "intent": "Escolher hierarquia e geometria como decisões independentes",
      "guidePath": "tutorials/03-product-arrangement/README.md",
      "previewPath": "tutorials/03-product-arrangement/walkthrough.svg",
      "artifactPaths": ["cookbook/product-arrangements.svg", "../authoring-patterns.json"],
      "featureGuideIds": ["visual.editorial-depth"],
      "capabilityIds": ["distinctProductModes", "independentProductArrangement", "specificationDensityControls"],
      "componentTypes": ["product-card", "specification"],
      "recipeIds": []
    },
    {
      "id": "tutorial.table-columns",
      "kind": "tutorial",
      "title": "Tabela comercial completa",
      "intent": "Editar linhas e projeção de colunas sem perder chaves ou conteúdo",
      "guidePath": "tutorials/04-table-columns/README.md",
      "previewPath": "tutorials/04-table-columns/walkthrough.svg",
      "artifactPaths": ["cookbook/table-columns.svg", "../authoring-patterns.json"],
      "featureGuideIds": ["content.table"],
      "capabilityIds": ["semanticTables", "contextualTableRows", "tableColumnPresentationControls"],
      "componentTypes": ["data-table"],
      "recipeIds": []
    },
    {
      "id": "tutorial.variants-legends",
      "kind": "tutorial",
      "title": "Variações e legendas vinculadas",
      "intent": "Vincular entidade, imagem, linha comercial e classificação explicitamente",
      "guidePath": "tutorials/05-variants-legends/README.md",
      "previewPath": "tutorials/05-variants-legends/walkthrough.svg",
      "artifactPaths": ["../examples/reference-catalog-source.json"],
      "featureGuideIds": ["content.variants", "content.legends"],
      "capabilityIds": ["semanticProductVariants", "linkedVariantRepresentations", "semanticColorLegends", "hierarchicalVisualLegends"],
      "componentTypes": ["art-gallery", "legend-panel", "legend-item", "data-table"],
      "recipeIds": ["section-packaging-legend"]
    },
    {
      "id": "tutorial.footer-span",
      "kind": "tutorial",
      "title": "Rodapé com ocupação ponderada",
      "intent": "Fazer o primeiro item ocupar duas posições e reduzir a escala interna dos textos",
      "guidePath": "tutorials/06-footer-span/README.md",
      "previewPath": "tutorials/06-footer-span/walkthrough.svg",
      "artifactPaths": ["cookbook/footer-span.svg", "../authoring-patterns.json"],
      "featureGuideIds": ["layout.slot-span", "visual.editorial-depth"],
      "capabilityIds": ["slotSpanControl", "editorialTextControls"],
      "componentTypes": ["catalog-footer", "footer-item", "text"],
      "recipeIds": []
    },
    {
      "id": "tutorial.delivery-gates",
      "kind": "tutorial",
      "title": "Gate de entrega",
      "intent": "Eliminar bloqueadores reais e exportar pacote e PDF verificáveis",
      "guidePath": "tutorials/07-delivery-gates/README.md",
      "previewPath": "tutorials/07-delivery-gates/walkthrough.svg",
      "artifactPaths": ["troubleshooting/GATES.md", "troubleshooting/gates.svg", "examples/first-page.report.json"],
      "featureGuideIds": ["safety.history", "transfer.package", "transfer.pdf"],
      "capabilityIds": ["draftPublicationGates", "geometricPublicationGate", "selectionGeometryDiagnostics", "projectPackageExport", "printPdf"],
      "componentTypes": [],
      "recipeIds": []
    },
    {
      "id": "cookbook.product-arrangements",
      "kind": "cookbook",
      "title": "Comparação de modos e arranjos",
      "intent": "Reconhecer combinações hero, technical e variants",
      "guidePath": "cookbook/README.md",
      "previewPath": "cookbook/product-arrangements.svg",
      "artifactPaths": [],
      "featureGuideIds": ["visual.editorial-depth"],
      "capabilityIds": ["distinctProductModes", "independentProductArrangement"],
      "componentTypes": ["product-card"],
      "recipeIds": []
    },
    {
      "id": "cookbook.semantic-pieces",
      "kind": "cookbook",
      "title": "Specification, fact ou legenda",
      "intent": "Escolher a peça semântica adequada",
      "guidePath": "cookbook/README.md",
      "previewPath": "cookbook/semantic-pieces.svg",
      "artifactPaths": [],
      "featureGuideIds": ["content.semantic-pieces"],
      "capabilityIds": ["semanticColorLegends"],
      "componentTypes": ["specification", "legend-item"],
      "recipeIds": ["fact"]
    },
    {
      "id": "cookbook.table-columns",
      "kind": "cookbook",
      "title": "Key, label, ordem e visible",
      "intent": "Distinguir identidade de apresentação de coluna",
      "guidePath": "cookbook/README.md",
      "previewPath": "cookbook/table-columns.svg",
      "artifactPaths": [],
      "featureGuideIds": ["content.table"],
      "capabilityIds": ["tableColumnPresentationControls"],
      "componentTypes": ["data-table"],
      "recipeIds": []
    },
    {
      "id": "cookbook.footer-span",
      "kind": "cookbook",
      "title": "Span e escala do rodapé",
      "intent": "Comparar ocupação externa e escala interna",
      "guidePath": "cookbook/README.md",
      "previewPath": "cookbook/footer-span.svg",
      "artifactPaths": [],
      "featureGuideIds": ["layout.slot-span"],
      "capabilityIds": ["slotSpanControl", "editorialTextControls"],
      "componentTypes": ["footer-item", "text"],
      "recipeIds": []
    },
    {
      "id": "cookbook.factual-image-fit",
      "kind": "cookbook",
      "title": "Stretch, cover e contain",
      "intent": "Evitar deformação ou recorte de produto factual",
      "guidePath": "cookbook/README.md",
      "previewPath": "cookbook/factual-image-fit.svg",
      "artifactPaths": [],
      "featureGuideIds": ["content.assets"],
      "capabilityIds": ["assetFormats", "packageAssetPolicy"],
      "componentTypes": ["art"],
      "recipeIds": []
    },
    {
      "id": "case-study.technical-catalog",
      "kind": "case-study",
      "title": "Catálogo técnico A4",
      "intent": "Decompor uma evidência técnica conhecida por capacidade, sem torná-la normativa",
      "guidePath": "case-studies/catalogo-tecnico/README.md",
      "previewPath": "case-studies/catalogo-tecnico/decomposition.svg",
      "artifactPaths": ["case-studies/catalogo-tecnico/reference.jpeg"],
      "featureGuideIds": ["start.page-structure", "content.cards-from-products", "content.table", "content.variants", "layout.slot-span"],
      "capabilityIds": ["heroGridStripComposition", "semanticTables", "semanticProductVariants", "slotSpanControl"],
      "componentTypes": ["catalog-header", "product-card", "data-table", "legend-panel", "catalog-footer"],
      "recipeIds": ["page-catalog-base", "section-hero-grid-strip", "section-packaging-legend", "section-tip-callout"]
    },
    {
      "id": "case-study.promotional",
      "kind": "case-study",
      "title": "Peça promocional Pé para Móveis",
      "intent": "Separar receitas atuais de composição gráfica livre pós-V1",
      "guidePath": "case-studies/promocional/README.md",
      "previewPath": "case-studies/promocional/decomposition.svg",
      "artifactPaths": ["case-studies/promocional/reference.jpeg"],
      "featureGuideIds": ["content.cards-from-products", "content.semantic-pieces", "transfer.pdf"],
      "capabilityIds": ["officialSectionRecipes", "printPdf"],
      "componentTypes": ["product-card", "text", "art", "footer-item"],